{
  "mode": "mock",
  "notice": "Dados sintéticos para demonstrar a interface. Não representam estatísticas reais. As fontes indicadas são referências para substituição futura.",
  "years": [
    2010,
    2011,
    2012,
    2013,
    2014,
    2015,
    2016,
    2017,
    2018,
    2019,
    2020,
    2021,
    2022,
    2023,
    2024
  ],
  "countries": [
    {
      "id": "076",
      "iso3": "BRA",
      "name": "Brasil"
    },
    {
      "id": "840",
      "iso3": "USA",
      "name": "Estados Unidos"
    },
    {
      "id": "156",
      "iso3": "CHN",
      "name": "China"
    },
    {
      "id": "356",
      "iso3": "IND",
      "name": "Índia"
    },
    {
      "id": "276",
      "iso3": "DEU",
      "name": "Alemanha"
    },
    {
      "id": "392",
      "iso3": "JPN",
      "name": "Japão"
    },
    {
      "id": "826",
      "iso3": "GBR",
      "name": "Reino Unido"
    },
    {
      "id": "250",
      "iso3": "FRA",
      "name": "França"
    },
    {
      "id": "124",
      "iso3": "CAN",
      "name": "Canadá"
    },
    {
      "id": "036",
      "iso3": "AUS",
      "name": "Austrália"
    },
    {
      "id": "710",
      "iso3": "ZAF",
      "name": "África do Sul"
    },
    {
      "id": "566",
      "iso3": "NGA",
      "name": "Nigéria"
    },
    {
      "id": "818",
      "iso3": "EGY",
      "name": "Egito"
    },
    {
      "id": "484",
      "iso3": "MEX",
      "name": "México"
    },
    {
      "id": "032",
      "iso3": "ARG",
      "name": "Argentina"
    },
    {
      "id": "152",
      "iso3": "CHL",
      "name": "Chile"
    },
    {
      "id": "643",
      "iso3": "RUS",
      "name": "Rússia"
    },
    {
      "id": "360",
      "iso3": "IDN",
      "name": "Indonésia"
    },
    {
      "id": "682",
      "iso3": "SAU",
      "name": "Arábia Saudita"
    },
    {
      "id": "792",
      "iso3": "TUR",
      "name": "Turquia"
    },
    {
      "id": "724",
      "iso3": "ESP",
      "name": "Espanha"
    },
    {
      "id": "380",
      "iso3": "ITA",
      "name": "Itália"
    },
    {
      "id": "404",
      "iso3": "KEN",
      "name": "Quênia"
    },
    {
      "id": "752",
      "iso3": "SWE",
      "name": "Suécia"
    }
  ],
  "indicators": [
    {
      "id": "gdp",
      "label": "PIB",
      "category": "economy",
      "unit": "US$ trilhões",
      "source": {
        "name": "Banco Mundial · World Development Indicators",
        "url": "https://data.worldbank.org/indicator/NY.GDP.MKTP.CD",
        "code": "NY.GDP.MKTP.CD",
        "api": "https://api.worldbank.org/v2/country/all/indicator/NY.GDP.MKTP.CD?format=json&per_page=20000"
      },
      "values": {
        "124": [
          14.36,
          14.79,
          15.12,
          15.39,
          15.67,
          16.02,
          16.49,
          17.09,
          17.8,
          18.58,
          19.38,
          20.11,
          20.74,
          21.25,
          21.63
        ],
        "152": [
          13.43,
          13.71,
          13.97,
          14.26,
          14.64,
          15.13,
          15.75,
          16.46,
          17.21,
          17.95,
          18.6,
          19.15,
          19.57,
          19.89,
          20.16
        ],
        "156": [
          7.53,
          7.73,
          7.88,
          8.02,
          8.19,
          8.41,
          8.69,
          9.04,
          9.44,
          9.86,
          10.26,
          10.62,
          10.92,
          11.14,
          11.32
        ],
        "250": [
          4.48,
          4.69,
          4.87,
          5.01,
          5.11,
          5.2,
          5.28,
          5.4,
          5.54,
          5.73,
          5.96,
          6.2,
          6.45,
          6.69,
          6.89
        ],
        "276": [
          9.19,
          9.47,
          9.84,
          10.3,
          10.82,
          11.36,
          11.89,
          12.35,
          12.74,
          13.03,
          13.25,
          13.44,
          13.63,
          13.88,
          14.2
        ],
        "356": [
          16.83,
          17.16,
          17.54,
          18.05,
          18.7,
          19.51,
          20.43,
          21.39,
          22.32,
          23.14,
          23.82,
          24.34,
          24.74,
          25.07,
          25.41
        ],
        "360": [
          14.72,
          15.3,
          16.02,
          16.85,
          17.73,
          18.58,
          19.35,
          19.99,
          20.48,
          20.86,
          21.16,
          21.47,
          21.85,
          22.35,
          22.99
        ],
        "380": [
          3.01,
          3.08,
          3.14,
          3.19,
          3.27,
          3.36,
          3.48,
          3.63,
          3.79,
          3.96,
          4.12,
          4.25,
          4.36,
          4.45,
          4.51
        ],
        "392": [
          2.1,
          2.21,
          2.33,
          2.45,
          2.58,
          2.68,
          2.77,
          2.84,
          2.89,
          2.93,
          2.98,
          3.03,
          3.11,
          3.2,
          3.31
        ],
        "404": [
          12.37,
          12.62,
          12.93,
          13.33,
          13.85,
          14.47,
          15.17,
          15.88,
          16.55,
          17.13,
          17.59,
          17.94,
          18.22,
          18.46,
          18.72
        ],
        "484": [
          11.1,
          11.68,
          12.18,
          12.57,
          12.87,
          13.11,
          13.32,
          13.56,
          13.88,
          14.29,
          14.8,
          15.4,
          16.02,
          16.63,
          17.18
        ],
        "566": [
          8.4,
          8.78,
          9.23,
          9.72,
          10.22,
          10.69,
          11.08,
          11.4,
          11.64,
          11.83,
          12,
          12.19,
          12.44,
          12.78,
          13.19
        ],
        "643": [
          5.76,
          5.89,
          6.06,
          6.28,
          6.55,
          6.87,
          7.2,
          7.53,
          7.82,
          8.06,
          8.25,
          8.39,
          8.51,
          8.63,
          8.77
        ],
        "682": [
          7.78,
          8.21,
          8.67,
          9.12,
          9.52,
          9.86,
          10.11,
          10.31,
          10.47,
          10.63,
          10.83,
          11.09,
          11.43,
          11.83,
          12.28
        ],
        "710": [
          15.68,
          16.09,
          16.63,
          17.32,
          18.15,
          19.06,
          19.97,
          20.82,
          21.55,
          22.14,
          22.58,
          22.92,
          23.23,
          23.59,
          24.05
        ],
        "724": [
          10.55,
          10.97,
          11.3,
          11.55,
          11.76,
          11.96,
          12.21,
          12.54,
          12.97,
          13.49,
          14.06,
          14.64,
          15.19,
          15.67,
          16.05
        ],
        "752": [
          4.93,
          5.1,
          5.31,
          5.57,
          5.85,
          6.15,
          6.42,
          6.66,
          6.85,
          7,
          7.11,
          7.21,
          7.32,
          7.46,
          7.65
        ],
        "792": [
          17.57,
          18.55,
          19.43,
          20.16,
          20.72,
          21.15,
          21.5,
          21.85,
          22.28,
          22.85,
          23.58,
          24.47,
          25.45,
          26.45,
          27.39
        ],
        "818": [
          1.43,
          1.51,
          1.59,
          1.67,
          1.74,
          1.79,
          1.83,
          1.86,
          1.89,
          1.92,
          1.96,
          2.02,
          2.09,
          2.16,
          2.25
        ],
        "826": [
          11.52,
          12.19,
          12.84,
          13.41,
          13.88,
          14.25,
          14.52,
          14.75,
          14.99,
          15.29,
          15.68,
          16.18,
          16.78,
          17.44,
          18.11
        ],
        "840": [
          15.03,
          15.68,
          16.19,
          16.58,
          16.88,
          17.16,
          17.5,
          17.93,
          18.5,
          19.2,
          20,
          20.84,
          21.65,
          22.37,
          22.95
        ],
        "076": [
          5.1,
          5.39,
          5.65,
          5.88,
          6.06,
          6.19,
          6.3,
          6.4,
          6.52,
          6.67,
          6.87,
          7.11,
          7.39,
          7.69,
          7.97
        ],
        "036": [
          6.66,
          6.79,
          6.92,
          7.09,
          7.31,
          7.59,
          7.93,
          8.3,
          8.67,
          9.02,
          9.32,
          9.56,
          9.74,
          9.88,
          10.01
        ],
        "032": [
          3.78,
          3.91,
          4.01,
          4.09,
          4.16,
          4.24,
          4.35,
          4.48,
          4.65,
          4.85,
          5.06,
          5.26,
          5.45,
          5.6,
          5.72
        ]
      }
    },
    {
      "id": "income",
      "label": "PIB per capita",
      "category": "economy",
      "unit": "US$ mil",
      "source": {
        "name": "Banco Mundial · World Development Indicators",
        "url": "https://data.worldbank.org/indicator/NY.GDP.PCAP.CD",
        "code": "NY.GDP.PCAP.CD",
        "api": "https://api.worldbank.org/v2/country/all/indicator/NY.GDP.PCAP.CD?format=json&per_page=20000"
      },
      "values": {
        "124": [
          6.48,
          6.67,
          6.82,
          6.94,
          7.07,
          7.23,
          7.44,
          7.71,
          8.03,
          8.38,
          8.74,
          9.07,
          9.36,
          9.58,
          9.76
        ],
        "152": [